job_id,job_title,company,industry,description,required_skills,education_requirement,experience_requirement,salary_range,location
1,Software Engineer,TechCorp,Technology,"Develop and maintain web applications using modern frameworks. Work with cross-functional teams to deliver high-quality software solutions.","Python,JavaScript,React,SQL,Git",Bachelor,2-4 years,70000-95000,Remote
2,Data Scientist,DataInc,Technology,"Analyze large datasets to extract insights and build predictive models. Present findings to stakeholders and drive data-driven decisions.","Python,R,SQL,Machine Learning,Statistics",Master,3-5 years,85000-120000,San Francisco
3,Product Manager,InnovateCo,Technology,"Lead product development from conception to launch. Coordinate with engineering, design, and marketing teams to deliver successful products.","Project Management,Analytics,Leadership,Communication",Bachelor,3-6 years,90000-130000,Seattle
4,Marketing Specialist,BrandAgency,Marketing,"Create and execute marketing campaigns across digital channels. Analyze campaign performance and optimize for better results.","Google Analytics,Social Media,Content Creation,SEO",Bachelor,1-3 years,45000-65000,Chicago
5,UX/UI Designer,DesignStudio,Design,"Design user interfaces and experiences for web and mobile applications. Conduct user research and create wireframes and prototypes.","Figma,Sketch,User Research,Prototyping,HTML/CSS",Bachelor,2-4 years,60000-85000,Austin
6,Financial Analyst,FinanceGroup,Finance,"Perform financial analysis and modeling to support business decisions. Prepare reports and presentations for senior management.","Excel,Financial Modeling,Bloomberg,PowerPoint",Bachelor,2-4 years,65000-80000,New York
7,Research Scientist,BioTech Labs,Biotechnology,"Conduct research in drug discovery and development. Design experiments and analyze results to advance therapeutic programs.","Lab Techniques,Statistics,Scientific Writing,R",PhD,2-5 years,80000-110000,Boston
8,Mechanical Engineer,Manufacturing Inc,Manufacturing,"Design and optimize manufacturing processes and equipment. Collaborate with production teams to improve efficiency and quality.","CAD,MATLAB,Project Management,Manufacturing Processes",Bachelor,2-5 years,70000-96000,Detroit
9,Business Analyst,ConsultingFirm,Consulting,"Analyze business processes and recommend improvements. Work with clients to implement solutions and measure results.","Excel,PowerBI,Process Mapping,Communication",Bachelor,2-4 years,70000-90000,Washington DC
10,Graphic Designer,Creative Agency,Design,"Create visual designs for print and digital media. Work with clients to develop brand identities and marketing materials.","Photoshop,Illustrator,InDesign,Branding",Bachelor,1-3 years,40000-60000,Los Angeles
11,Sales Representative,SalesCorp,Sales,"Generate new business and maintain client relationships. Meet sales targets and provide excellent customer service.","Communication,CRM,Negotiation,Relationship Building",High School,1-3 years,40000-70000,Various
12,Web Developer,WebSolutions,Technology,"Build responsive websites and web applications. Work with designers and content creators to deliver engaging user experiences.","HTML,CSS,JavaScript,React,PHP",Associate,1-3 years,50000-75000,Remote
13,HR Generalist,PeopleFirst,Human Resources,"Support all aspects of human resources including recruitment, employee relations, and benefits administration.","HR Software,Communication,Conflict Resolution,Compliance",Bachelor,2-4 years,50000-70000,Denver
14,Accountant,NumbersCorp,Finance,"Manage accounts payable/receivable, prepare financial statements, and ensure compliance with accounting standards.","QuickBooks,Excel,Tax Knowledge,Attention to Detail",Bachelor,2-4 years,45000-65000,Phoenix
15,Content Writer,MediaHouse,Media,"Create engaging content for websites, blogs, and social media. Research topics and optimize content for search engines.","Writing,SEO,Content Management,Research",Bachelor,1-3 years,35000-55000,Remote
16,Operations Manager,LogisticsPro,Logistics,"Oversee daily operations and optimize processes for efficiency. Manage teams and coordinate with multiple departments.","Leadership,Process Improvement,Analytics,Communication",Bachelor,4-7 years,75000-100000,Atlanta
17,Quality Assurance Engineer,TestingInc,Technology,"Test software applications to identify bugs and ensure quality standards. Create test plans and document issues.","Testing,Automation,Attention to Detail,Problem Solving",Bachelor,2-4 years,60000-80000,San Diego
18,Environmental Consultant,GreenConsulting,Environmental,"Assess environmental impact of projects and recommend mitigation strategies. Prepare reports and ensure regulatory compliance.","Environmental Science,GIS,Technical Writing,Compliance",Master,3-5 years,65000-85000,Portland
19,Project Coordinator,ProjectPros,Various,"Coordinate project activities and ensure timely delivery. Communicate with stakeholders and track project progress.","Project Management,Communication,Organization,MS Office",Bachelor,1-3 years,45000-65000,Multiple
20,Database Administrator,DataSystems,Technology,"Maintain and optimize database systems. Ensure data security and backup procedures are followed.","SQL,Database Management,Security,Troubleshooting",Bachelor,3-5 years,70000-95000,Remote
21,Social Media Manager,SocialBuzz,Marketing,"Manage social media accounts and create engaging content. Analyze metrics and adjust strategies for better engagement.","Social Media Platforms,Content Creation,Analytics,Communication",Bachelor,2-4 years,40000-60000,Miami
22,Biomedical Engineer,MedDevice Corp,Healthcare,"Design and develop medical devices and equipment. Ensure compliance with regulatory standards and safety requirements.","CAD,MATLAB,Regulatory Knowledge,Problem Solving",Bachelor,2-5 years,75000-100000,Minneapolis
23,Investment Analyst,WealthAdvisors,Finance,"Analyze investment opportunities and market trends. Prepare research reports and investment recommendations.","Financial Analysis,Excel,Bloomberg,Research",Bachelor,2-4 years,70000-90000,New York
24,Technical Writer,TechDocs,Technology,"Create technical documentation for software and hardware products. Work with engineers to translate complex concepts into clear instructions.","Technical Writing,Documentation Tools,Communication,Research",Bachelor,2-4 years,55000-75000,Remote
25,Supply Chain Analyst,GlobalLogistics,Logistics,"Analyze supply chain operations and identify improvement opportunities. Optimize inventory levels and reduce costs.","Analytics,Excel,Supply Chain Management,Problem Solving",Bachelor,2-4 years,60000-80000,Chicago
26,Cybersecurity Specialist,SecureIT,Technology,"Monitor and protect computer systems from security threats. Implement security measures and respond to incidents.","Network Security,Ethical Hacking,Risk Assessment,Compliance",Bachelor,3-5 years,80000-110000,Washington DC
27,Market Research Analyst,InsightsCorp,Research,"Conduct market research and analyze consumer behavior. Prepare reports and presentations with actionable insights.","Statistics,Survey Design,Data Analysis,Presentation Skills",Bachelor,2-4 years,50000-70000,New York
28,Clinical Research Coordinator,PharmaTrials,Healthcare,"Coordinate clinical trials and ensure compliance with protocols. Collect and manage trial data.","Clinical Research,Attention to Detail,Communication,Compliance",Bachelor,2-4 years,55000-75000,Research Triangle
29,SEO Specialist,DigitalMarketing Pro,Marketing,"Optimize websites for search engines and improve organic rankings. Analyze website performance and implement SEO strategies.","SEO,Google Analytics,Content Optimization,Technical SEO",Bachelor,2-4 years,45000-65000,Remote
30,DevOps Engineer,CloudTech,Technology,"Automate deployment processes and manage cloud infrastructure. Ensure system reliability and performance.","AWS,Docker,Kubernetes,Python,Linux",Bachelor,3-5 years,85000-115000,San Francisco